{
  "proposal_id": "prop_warn_credential",
  "timestamp": "2026-01-01T10:32:15Z",
  "mode": "SUGGEST",
  "action_type": "TYPE_TEXT",
  "payload": {
    "text": "AKIAIOSFODNN7EXAMPLE"
  },
  "rationale": "WARNING: Detected what appears to be an AWS access key pattern on screen. This action is flagged for operator review.",
  "credential_warning": true,
  "safety_bounds": {
    "max_text_length": 1024,
    "min_action_delay_ms": 100
  }
}
